[
  {
    "metric_id": "total_in_custody",
    "label": "Total in custody, nationwide",
    "unit": "count",
    "scope": "national",
    "state": null,
    "facility": null,
    "case_ref": null,
    "value": 81902.0,
    "period": "2026",
    "period_type": "point_in_time",
    "source_id": "world_prison_brief",
    "source_url": "https://www.prisonstudies.org/country/nigeria",
    "fetched_at": "2026-08-31",
    "confidence_tier": 1,
    "verified_by": "scraper:world_prison_brief",
    "notes": "As of 2026-06-22"
  },
  {
    "metric_id": "pretrial_detention_rate",
    "label": "Pretrial detention share, national",
    "unit": "percent",
    "scope": "national",
    "state": null,
    "facility": null,
    "case_ref": null,
    "value": 65.2,
    "period": "2026",
    "period_type": "point_in_time",
    "source_id": "world_prison_brief",
    "source_url": "https://www.prisonstudies.org/country/nigeria",
    "fetched_at": "2026-08-31",
    "confidence_tier": 1,
    "verified_by": "scraper:world_prison_brief",
    "notes": "As of 2026-06-22"
  },
  {
    "metric_id": "official_capacity",
    "label": "Official capacity of correctional system",
    "unit": "count",
    "scope": "national",
    "state": null,
    "facility": null,
    "case_ref": null,
    "value": 65035.0,
    "period": "2025",
    "period_type": "point_in_time",
    "source_id": "world_prison_brief",
    "source_url": "https://www.prisonstudies.org/country/nigeria",
    "fetched_at": "2026-08-31",
    "confidence_tier": 1,
    "verified_by": "scraper:world_prison_brief",
    "notes": "As of 2025-06-30"
  },
  {
    "metric_id": "occupancy_rate",
    "label": "Occupancy vs. official capacity",
    "unit": "percent",
    "scope": "national",
    "state": null,
    "facility": null,
    "case_ref": null,
    "value": 125.6,
    "period": "2025",
    "period_type": "point_in_time",
    "source_id": "world_prison_brief",
    "source_url": "https://www.prisonstudies.org/country/nigeria",
    "fetched_at": "2026-08-31",
    "confidence_tier": 1,
    "verified_by": "scraper:world_prison_brief",
    "notes": "As of 2025-06-30"
  },
  {
    "metric_id": "pretrial_detention_rate",
    "label": "Pretrial detention share, national",
    "unit": "percent",
    "scope": "national",
    "state": null,
    "facility": null,
    "case_ref": null,
    "value": 62.9,
    "period": "2000",
    "period_type": "annual",
    "source_id": "world_prison_brief",
    "source_url": "https://www.prisonstudies.org/country/nigeria",
    "fetched_at": "2026-08-31",
    "confidence_tier": 1,
    "verified_by": "manual:hand-verified-2026-08",
    "notes": "Historical trend point, hand-transcribed from the site's five-year trend table (see adapter docstring for why it isn't auto-parsed)."
  },
  {
    "metric_id": "pretrial_detention_rate",
    "label": "Pretrial detention share, national",
    "unit": "percent",
    "scope": "national",
    "state": null,
    "facility": null,
    "case_ref": null,
    "value": 74.0,
    "period": "2005",
    "period_type": "annual",
    "source_id": "world_prison_brief",
    "source_url": "https://www.prisonstudies.org/country/nigeria",
    "fetched_at": "2026-08-31",
    "confidence_tier": 1,
    "verified_by": "manual:hand-verified-2026-08",
    "notes": "Historical trend point, hand-transcribed from the site's five-year trend table (see adapter docstring for why it isn't auto-parsed)."
  },
  {
    "metric_id": "pretrial_detention_rate",
    "label": "Pretrial detention share, national",
    "unit": "percent",
    "scope": "national",
    "state": null,
    "facility": null,
    "case_ref": null,
    "value": 72.9,
    "period": "2010",
    "period_type": "annual",
    "source_id": "world_prison_brief",
    "source_url": "https://www.prisonstudies.org/country/nigeria",
    "fetched_at": "2026-08-31",
    "confidence_tier": 1,
    "verified_by": "manual:hand-verified-2026-08",
    "notes": "Historical trend point, hand-transcribed from the site's five-year trend table (see adapter docstring for why it isn't auto-parsed)."
  },
  {
    "metric_id": "pretrial_detention_rate",
    "label": "Pretrial detention share, national",
    "unit": "percent",
    "scope": "national",
    "state": null,
    "facility": null,
    "case_ref": null,
    "value": 69.3,
    "period": "2015",
    "period_type": "annual",
    "source_id": "world_prison_brief",
    "source_url": "https://www.prisonstudies.org/country/nigeria",
    "fetched_at": "2026-08-31",
    "confidence_tier": 1,
    "verified_by": "manual:hand-verified-2026-08",
    "notes": "Historical trend point, hand-transcribed from the site's five-year trend table (see adapter docstring for why it isn't auto-parsed)."
  },
  {
    "metric_id": "pretrial_detention_rate",
    "label": "Pretrial detention share, national",
    "unit": "percent",
    "scope": "national",
    "state": null,
    "facility": null,
    "case_ref": null,
    "value": 73.8,
    "period": "2020",
    "period_type": "annual",
    "source_id": "world_prison_brief",
    "source_url": "https://www.prisonstudies.org/country/nigeria",
    "fetched_at": "2026-08-31",
    "confidence_tier": 1,
    "verified_by": "manual:hand-verified-2026-08",
    "notes": "Historical trend point, hand-transcribed from the site's five-year trend table (see adapter docstring for why it isn't auto-parsed)."
  }
]
