[
  {
    "metric_id": "awaiting_trial_count",
    "label": "Awaiting-trial population",
    "unit": "count",
    "scope": "state",
    "state": "Kano",
    "facility": null,
    "case_ref": null,
    "value": 3860,
    "period": "2026-08",
    "period_type": "monthly",
    "source_id": "test_mock_state_feed",
    "source_url": null,
    "fetched_at": "2026-08-24",
    "confidence_tier": 4,
    "verified_by": null,
    "notes": "NOT REAL. Fixture -- see above."
  },
  {
    "metric_id": "awaiting_trial_count",
    "label": "Awaiting-trial population",
    "unit": "count",
    "scope": "state",
    "state": "Lagos",
    "facility": null,
    "case_ref": null,
    "value": 4210,
    "period": "2026-08",
    "period_type": "monthly",
    "source_id": "test_mock_state_feed",
    "source_url": null,
    "fetched_at": "2026-08-24",
    "confidence_tier": 4,
    "verified_by": null,
    "notes": "NOT REAL. Fixture proving the pipeline ingests state-scoped data (a shape CIMS/state-court feeds will actually use) without any change to the schema or build script."
  },
  {
    "metric_id": "median_days_in_custody",
    "label": "Median days held, awaiting trial",
    "unit": "days",
    "scope": "state",
    "state": "Kano",
    "facility": null,
    "case_ref": null,
    "value": 198,
    "period": "2026-08",
    "period_type": "monthly",
    "source_id": "test_mock_state_feed",
    "source_url": null,
    "fetched_at": "2026-08-24",
    "confidence_tier": 4,
    "verified_by": null,
    "notes": "NOT REAL. Fixture -- 198 days exceeds ACJA's 180-day ceiling, deliberately, to prove a downstream 'breach' flag can be derived from this shape of data."
  },
  {
    "metric_id": "median_days_in_custody",
    "label": "Median days held, awaiting trial",
    "unit": "days",
    "scope": "state",
    "state": "Lagos",
    "facility": null,
    "case_ref": null,
    "value": 142,
    "period": "2026-08",
    "period_type": "monthly",
    "source_id": "test_mock_state_feed",
    "source_url": null,
    "fetched_at": "2026-08-24",
    "confidence_tier": 4,
    "verified_by": null,
    "notes": "NOT REAL. Fixture -- see awaiting_trial_count entry above."
  },
  {
    "metric_id": "occupancy_rate",
    "label": "Occupancy vs. official capacity",
    "unit": "percent",
    "scope": "national",
    "state": null,
    "facility": null,
    "case_ref": null,
    "value": 125.6,
    "period": "2025",
    "period_type": "point_in_time",
    "source_id": "world_prison_brief",
    "source_url": "https://www.prisonstudies.org/country/nigeria",
    "fetched_at": "2026-08-31",
    "confidence_tier": 1,
    "verified_by": "scraper:world_prison_brief",
    "notes": "As of 2025-06-30"
  },
  {
    "metric_id": "official_capacity",
    "label": "Official capacity of correctional system",
    "unit": "count",
    "scope": "national",
    "state": null,
    "facility": null,
    "case_ref": null,
    "value": 65035.0,
    "period": "2025",
    "period_type": "point_in_time",
    "source_id": "world_prison_brief",
    "source_url": "https://www.prisonstudies.org/country/nigeria",
    "fetched_at": "2026-08-31",
    "confidence_tier": 1,
    "verified_by": "scraper:world_prison_brief",
    "notes": "As of 2025-06-30"
  },
  {
    "metric_id": "pretrial_detention_rate",
    "label": "Pretrial detention share, national",
    "unit": "percent",
    "scope": "national",
    "state": null,
    "facility": null,
    "case_ref": null,
    "value": 62.9,
    "period": "2000",
    "period_type": "annual",
    "source_id": "world_prison_brief",
    "source_url": "https://www.prisonstudies.org/country/nigeria",
    "fetched_at": "2026-08-31",
    "confidence_tier": 1,
    "verified_by": "manual:hand-verified-2026-08",
    "notes": "Historical trend point, hand-transcribed from the site's five-year trend table (see adapter docstring for why it isn't auto-parsed)."
  },
  {
    "metric_id": "pretrial_detention_rate",
    "label": "Pretrial detention share, national",
    "unit": "percent",
    "scope": "national",
    "state": null,
    "facility": null,
    "case_ref": null,
    "value": 74.0,
    "period": "2005",
    "period_type": "annual",
    "source_id": "world_prison_brief",
    "source_url": "https://www.prisonstudies.org/country/nigeria",
    "fetched_at": "2026-08-31",
    "confidence_tier": 1,
    "verified_by": "manual:hand-verified-2026-08",
    "notes": "Historical trend point, hand-transcribed from the site's five-year trend table (see adapter docstring for why it isn't auto-parsed)."
  },
  {
    "metric_id": "pretrial_detention_rate",
    "label": "Pretrial detention share, national",
    "unit": "percent",
    "scope": "national",
    "state": null,
    "facility": null,
    "case_ref": null,
    "value": 72.9,
    "period": "2010",
    "period_type": "annual",
    "source_id": "world_prison_brief",
    "source_url": "https://www.prisonstudies.org/country/nigeria",
    "fetched_at": "2026-08-31",
    "confidence_tier": 1,
    "verified_by": "manual:hand-verified-2026-08",
    "notes": "Historical trend point, hand-transcribed from the site's five-year trend table (see adapter docstring for why it isn't auto-parsed)."
  },
  {
    "metric_id": "pretrial_detention_rate",
    "label": "Pretrial detention share, national",
    "unit": "percent",
    "scope": "national",
    "state": null,
    "facility": null,
    "case_ref": null,
    "value": 69.3,
    "period": "2015",
    "period_type": "annual",
    "source_id": "world_prison_brief",
    "source_url": "https://www.prisonstudies.org/country/nigeria",
    "fetched_at": "2026-08-31",
    "confidence_tier": 1,
    "verified_by": "manual:hand-verified-2026-08",
    "notes": "Historical trend point, hand-transcribed from the site's five-year trend table (see adapter docstring for why it isn't auto-parsed)."
  },
  {
    "metric_id": "pretrial_detention_rate",
    "label": "Pretrial detention share, national",
    "unit": "percent",
    "scope": "national",
    "state": null,
    "facility": null,
    "case_ref": null,
    "value": 73.8,
    "period": "2020",
    "period_type": "annual",
    "source_id": "world_prison_brief",
    "source_url": "https://www.prisonstudies.org/country/nigeria",
    "fetched_at": "2026-08-31",
    "confidence_tier": 1,
    "verified_by": "manual:hand-verified-2026-08",
    "notes": "Historical trend point, hand-transcribed from the site's five-year trend table (see adapter docstring for why it isn't auto-parsed)."
  },
  {
    "metric_id": "pretrial_detention_rate",
    "label": "Pretrial detention share, national (NHRC/UNODC)",
    "unit": "percent",
    "scope": "national",
    "state": null,
    "facility": null,
    "case_ref": null,
    "value": 66.0,
    "period": "2025-07",
    "period_type": "monthly",
    "source_id": "nhrc_dashboard",
    "source_url": "https://www.unodc.org/conig/en/stories/pretrial-detention-drops-to-66-in-nigerias-custodial-centers--says-new-findings-from-unodc-and-national-human-rights-commission.html",
    "fetched_at": "2026-08-24",
    "confidence_tier": 2,
    "verified_by": "manual:jamar-2026-08-24",
    "notes": "Down from 70% in July 2024, per the joint NHRC/UNODC finding. This is an independent cross-check against the World Prison Brief figure -- a second source agreeing (both in the mid-60s%) is itself worth surfacing on the dashboard."
  },
  {
    "metric_id": "pretrial_detention_rate",
    "label": "Pretrial detention share, national",
    "unit": "percent",
    "scope": "national",
    "state": null,
    "facility": null,
    "case_ref": null,
    "value": 65.2,
    "period": "2026",
    "period_type": "point_in_time",
    "source_id": "world_prison_brief",
    "source_url": "https://www.prisonstudies.org/country/nigeria",
    "fetched_at": "2026-08-31",
    "confidence_tier": 1,
    "verified_by": "scraper:world_prison_brief",
    "notes": "As of 2026-06-22"
  },
  {
    "metric_id": "total_in_custody",
    "label": "Total in custody, nationwide",
    "unit": "count",
    "scope": "national",
    "state": null,
    "facility": null,
    "case_ref": null,
    "value": 81902.0,
    "period": "2026",
    "period_type": "point_in_time",
    "source_id": "world_prison_brief",
    "source_url": "https://www.prisonstudies.org/country/nigeria",
    "fetched_at": "2026-08-31",
    "confidence_tier": 1,
    "verified_by": "scraper:world_prison_brief",
    "notes": "As of 2026-06-22"
  }
]
