[
  {
    "metric_id": "awaiting_trial_count",
    "label": "Awaiting-trial population",
    "unit": "count",
    "scope": "state",
    "state": "Lagos",
    "facility": null,
    "case_ref": null,
    "value": 4210,
    "period": "2026-08",
    "period_type": "monthly",
    "source_id": "test_mock_state_feed",
    "source_url": null,
    "fetched_at": "2026-08-24",
    "confidence_tier": 4,
    "verified_by": null,
    "notes": "NOT REAL. Fixture proving the pipeline ingests state-scoped data (a shape CIMS/state-court feeds will actually use) without any change to the schema or build script."
  },
  {
    "metric_id": "median_days_in_custody",
    "label": "Median days held, awaiting trial",
    "unit": "days",
    "scope": "state",
    "state": "Lagos",
    "facility": null,
    "case_ref": null,
    "value": 142,
    "period": "2026-08",
    "period_type": "monthly",
    "source_id": "test_mock_state_feed",
    "source_url": null,
    "fetched_at": "2026-08-24",
    "confidence_tier": 4,
    "verified_by": null,
    "notes": "NOT REAL. Fixture -- see awaiting_trial_count entry above."
  },
  {
    "metric_id": "awaiting_trial_count",
    "label": "Awaiting-trial population",
    "unit": "count",
    "scope": "state",
    "state": "Kano",
    "facility": null,
    "case_ref": null,
    "value": 3860,
    "period": "2026-08",
    "period_type": "monthly",
    "source_id": "test_mock_state_feed",
    "source_url": null,
    "fetched_at": "2026-08-24",
    "confidence_tier": 4,
    "verified_by": null,
    "notes": "NOT REAL. Fixture -- see above."
  },
  {
    "metric_id": "median_days_in_custody",
    "label": "Median days held, awaiting trial",
    "unit": "days",
    "scope": "state",
    "state": "Kano",
    "facility": null,
    "case_ref": null,
    "value": 198,
    "period": "2026-08",
    "period_type": "monthly",
    "source_id": "test_mock_state_feed",
    "source_url": null,
    "fetched_at": "2026-08-24",
    "confidence_tier": 4,
    "verified_by": null,
    "notes": "NOT REAL. Fixture -- 198 days exceeds ACJA's 180-day ceiling, deliberately, to prove a downstream 'breach' flag can be derived from this shape of data."
  }
]
